{
  "$schema": "https://json-schema.org/draft/2020-12/schema",
  "$id": "https://hackforge.local/schemas/competition.json",
  "title": "CompetitionBrief",
  "type": "object",
  "required": ["name", "facts", "inference", "missing", "judging_criteria", "crowding"],
  "properties": {
    "name": { "type": "string" },
    "slug": { "type": "string" },
    "source_urls": { "type": "array", "items": { "type": "string" } },
    "theme": { "type": "string" },
    "tracks": { "type": "array", "items": { "type": "string" } },
    "sponsors": { "type": "array", "items": { "type": "string" } },
    "deadline": { "type": ["string", "null"] },
    "team_size": { "type": ["string", "null"] },
    "required_or_encouraged_tech": { "type": "array", "items": { "type": "string" } },
    "prizes": { "type": "array", "items": { "type": "string" } },
    "facts": {
      "type": "array",
      "items": {
        "type": "object",
        "required": ["claim", "source"],
        "properties": {
          "claim": { "type": "string" },
          "source": { "type": "string" },
          "confidence": { "type": "string", "enum": ["high", "medium", "low"] }
        }
      }
    },
    "inference": {
      "type": "array",
      "items": {
        "type": "object",
        "required": ["claim", "rationale"],
        "properties": {
          "claim": { "type": "string" },
          "rationale": { "type": "string" }
        }
      }
    },
    "missing": { "type": "array", "items": { "type": "string" } },
    "potentially_stale": { "type": "array", "items": { "type": "string" } },
    "judging_criteria": {
      "type": "array",
      "items": {
        "type": "object",
        "required": ["name", "weight_or_priority"],
        "properties": {
          "name": { "type": "string" },
          "weight_or_priority": { "type": "string" },
          "notes": { "type": "string" }
        }
      }
    },
    "sponsor_capabilities": { "type": "array", "items": { "type": "string" } },
    "available_datasets": { "type": "array", "items": { "type": "string" } },
    "crowding": {
      "type": "object",
      "required": ["high_collision", "medium_collision", "potentially_underexplored", "do_not_build"],
      "properties": {
        "high_collision": { "type": "array", "items": { "type": "string" } },
        "medium_collision": { "type": "array", "items": { "type": "string" } },
        "potentially_underexplored": { "type": "array", "items": { "type": "string" } },
        "do_not_build": { "type": "array", "items": { "type": "string" } }
      }
    },
    "sanitized_brief": { "type": "string" }
  }
}
